What common relegion affiliation exists for udit Raj and Wickramabahu Central College ?,SELECT DISTINCT ?uri WHERE { #ent <http://dbpedia.org/ontology/religion> ?uri. <http://dbpedia.org/resource/Wickramabahu_Central_College_(National_School)> <http://dbpedia.org/property/religiousAffiliation> ?uri}
What is the city  of the 2015 MLS All-Star Game and birthplace of the The Okee Dokee Brothers,SELECT DISTINCT ?uri WHERE { #ent <http://dbpedia.org/property/city> ?uri. #ent <http://dbpedia.org/ontology/birthPlace> ?uri}
How many people were opponents of the ones buried in the tower of London?,SELECT COUNT(DISTINCT ?uri) WHERE { ?x <http://dbpedia.org/property/restingPlace> #ent . ?x <http://dbpedia.org/ontology/opponent> ?uri  . ?uri <http://www.w3.org/1999/02/22-rdf-syntax-ns#type> <http://dbpedia.org/ontology/Person>}
Count all the places where companies located in Ontario operate.,SELECT COUNT(DISTINCT ?uri) WHERE { ?x <http://dbpedia.org/ontology/locationCity> #ent . ?x <http://dbpedia.org/property/locations> ?uri  . }
"What is the river whose origin is North-Western Province, Zambia?",SELECT DISTINCT ?uri WHERE {?uri <http://dbpedia.org/ontology/sourceRegion> #ent }
How many factions have fought when Egushawa was a commander?,SELECT COUNT(DISTINCT ?uri) WHERE { ?x <http://dbpedia.org/ontology/commander> #ent . ?x <http://dbpedia.org/property/combatant> ?uri  . }
What is the honorary title of the narrator of Everything Will Be OK?,SELECT DISTINCT ?uri WHERE { #ent <http://dbpedia.org/ontology/narrator> ?x . ?x <http://dbpedia.org/ontology/award> ?uri  . }
What is the layout of the automobiles designed by Olivier Boulay?,SELECT DISTINCT ?uri WHERE { ?x <http://dbpedia.org/property/designer> #ent . ?x <http://dbpedia.org/ontology/layout> ?uri  . ?x <http://www.w3.org/1999/02/22-rdf-syntax-ns#type> <http://dbpedia.org/ontology/Automobile>}
"What people were born in Ridgewood, New Jersey?",SELECT DISTINCT ?uri WHERE {?uri <http://dbpedia.org/property/birthPlace> #ent  . ?uri <http://www.w3.org/1999/02/22-rdf-syntax-ns#type> <http://dbpedia.org/ontology/Person>}
Which content license of the MSX BASIC is also the profession of the Laura K. Ipsen ?,SELECT DISTINCT ?uri WHERE { #ent <http://dbpedia.org/property/license> ?uri. #ent <http://dbpedia.org/ontology/occupation> ?uri}
Which predecessor of the PlayStation 4 is also the developer of Oddworld: Munch's Oddysee?,SELECT DISTINCT ?uri WHERE { #ent <http://dbpedia.org/property/predecessor> ?uri. #ent <http://dbpedia.org/ontology/developer> ?uri}
Who is the appointer of Charles Goodell ?,SELECT DISTINCT ?uri WHERE { #ent <http://dbpedia.org/ontology/appointer> ?uri }
Does the hudson river flow into the lower manhatten?,ASK WHERE { #ent <http://dbpedia.org/ontology/mouthMountain> #ent }
Which distributer of Glover is also the stockholde of Seattle Mariners ?,SELECT DISTINCT ?uri WHERE { <http://dbpedia.org/resource/Glover_(video_game)> <http://dbpedia.org/ontology/distributor> ?uri. #ent <http://dbpedia.org/ontology/owner> ?uri}
Name the person whose mother name is Cedella Booker and has a son named Sharon Marley?,SELECT DISTINCT ?uri WHERE {?uri <http://dbpedia.org/ontology/parent> #ent . ?uri <http://dbpedia.org/property/children> #ent  . ?uri <http://www.w3.org/1999/02/22-rdf-syntax-ns#type> <http://dbpedia.org/ontology/Person>}
Name the Chris Marve's school ?,SELECT DISTINCT ?uri WHERE { #ent <http://dbpedia.org/ontology/school> ?uri }
List the websites which the authors of Tornado own ?,SELECT DISTINCT ?uri WHERE { <http://dbpedia.org/resource/Tornado_(web_server)> <http://dbpedia.org/property/author> ?x . ?x <http://dbpedia.org/ontology/owner> ?uri  . }
What are the movies whose music composer is Akira Ifukube?,SELECT DISTINCT ?uri WHERE {?uri <http://dbpedia.org/ontology/musicComposer> #ent  . ?uri <http://www.w3.org/1999/02/22-rdf-syntax-ns#type> <http://dbpedia.org/ontology/Film>}
Which military personnel belong to the branch of Continental Army?,SELECT DISTINCT ?uri WHERE {?uri <http://dbpedia.org/ontology/militaryBranch> #ent }
Who have rented the stadium operated by Maple Leaf S&E?,SELECT DISTINCT ?uri WHERE { ?x <http://dbpedia.org/property/operator> <http://dbpedia.org/resource/Maple_Leaf_Sports_&_Entertainment> . ?x <http://dbpedia.org/ontology/tenant> ?uri  . ?x <http://www.w3.org/1999/02/22-rdf-syntax-ns#type> <http://dbpedia.org/ontology/Stadium>}
Which holy things canonized John of Damascus?,SELECT DISTINCT ?uri WHERE { #ent <http://dbpedia.org/ontology/canonizedBy> ?uri }
Solon Spencer Beman has architected in how many cities?,SELECT COUNT(DISTINCT ?uri) WHERE { ?x <http://dbpedia.org/ontology/architect> #ent . ?x <http://dbpedia.org/property/locationTown> ?uri  . ?uri <http://www.w3.org/1999/02/22-rdf-syntax-ns#type> <http://dbpedia.org/ontology/City>}
What are the main interests of Timothy Morton?,SELECT DISTINCT ?uri WHERE { #ent <http://dbpedia.org/property/mainInterests> ?uri }
Name someone known for a project involved in the Occupation of Japan?,SELECT DISTINCT ?uri WHERE { ?x <http://dbpedia.org/ontology/battle> #ent . ?uri <http://dbpedia.org/property/knownFor> ?x  . }
Count all those who previously played for a team which ownes Varsity Stadium ?,SELECT COUNT(DISTINCT ?uri) WHERE { ?x <http://dbpedia.org/property/field> #ent . ?uri <http://dbpedia.org/ontology/formerTeam> ?x  . }
Name the sea with Helsinki as one of the shore city and is also an outflow for Danish straits?,SELECT DISTINCT ?uri WHERE {?uri <http://dbpedia.org/property/cities> #ent . ?uri <http://dbpedia.org/property/outflow> #ent  . ?uri <http://www.w3.org/1999/02/22-rdf-syntax-ns#type> <http://dbpedia.org/ontology/Sea>}
Count the awards won by the people who graduated from the National and Kapodistrian University of Athens.,SELECT COUNT(DISTINCT ?uri) WHERE { ?x <http://dbpedia.org/ontology/almaMater> #ent . ?x <http://dbpedia.org/ontology/award> ?uri  . }
What awards have been given to the dude who made Shaun the Sheep?,SELECT DISTINCT ?uri WHERE { ?x <http://dbpedia.org/property/notableworks> #ent . ?x <http://dbpedia.org/ontology/award> ?uri  . ?x <http://www.w3.org/1999/02/22-rdf-syntax-ns#type> <http://dbpedia.org/ontology/Person>}
"Name the office holders whose successor died in Morristown, New Jersey?",SELECT DISTINCT ?uri WHERE { ?x <http://dbpedia.org/ontology/deathPlace> #ent . ?uri <http://dbpedia.org/ontology/successor> ?x  . ?uri <http://www.w3.org/1999/02/22-rdf-syntax-ns#type> <http://dbpedia.org/ontology/OfficeHolder>}
What are the movies with Daniel Waters as screenwriter?,SELECT DISTINCT ?uri WHERE {?uri <http://dbpedia.org/property/screenplay> <http://dbpedia.org/resource/Daniel_Waters_(screenwriter)>  . ?uri <http://www.w3.org/1999/02/22-rdf-syntax-ns#type> <http://dbpedia.org/ontology/Film>}
Which awards are presented by the committee located in Stockholm?,SELECT DISTINCT ?uri WHERE { ?x <http://dbpedia.org/property/headquarters> #ent . ?uri <http://dbpedia.org/ontology/presenter> ?x  . }
What is the common product of the Apple Productivity Experience Group and services of the 21Vianet ?,SELECT DISTINCT ?uri WHERE { #ent <http://dbpedia.org/ontology/product> ?uri. #ent <http://dbpedia.org/property/services> ?uri}
Who are the tenants of MasterCard Centre?,SELECT DISTINCT ?uri WHERE { #ent <http://dbpedia.org/property/tenants> ?uri }
Count the  area of the radio stations whose serves in South Carolina ?,SELECT COUNT(DISTINCT ?uri) WHERE { ?x <http://dbpedia.org/property/area> #ent . ?x <http://dbpedia.org/property/area> ?uri }
How many games are played at universities affiliated with the Association of Southeast Asian Institutions of Higher Learning?,SELECT COUNT(DISTINCT ?uri) WHERE { ?x <http://dbpedia.org/ontology/affiliation> #ent . ?x <http://dbpedia.org/ontology/sport> ?uri  . }
Which adminstrative region of Lawrence F. Cafero is also the resting place of Samuel Keeler ?,SELECT DISTINCT ?uri WHERE { #ent <http://dbpedia.org/ontology/region> ?uri. #ent <http://dbpedia.org/ontology/restingPlace> ?uri}
Who studied in universities located in suburbs?,SELECT DISTINCT ?uri WHERE { ?x <http://dbpedia.org/ontology/campus> #ent . ?uri <http://dbpedia.org/property/education> ?x  . }
List down the cinematographers of Mickey's Mellerdrammer?,SELECT DISTINCT ?uri WHERE { #ent <http://dbpedia.org/property/cinematography> ?uri }
List the relative of Tim Nanai-Williams ?,SELECT DISTINCT ?uri WHERE { #ent <http://dbpedia.org/ontology/relative> ?uri }
Who are the  judges of the television show whose anchor is Josh Groban?,SELECT DISTINCT ?uri WHERE { ?x <http://dbpedia.org/property/presenter> #ent . ?x <http://dbpedia.org/property/judges> ?uri  . ?x <http://www.w3.org/1999/02/22-rdf-syntax-ns#type> <http://dbpedia.org/ontology/TelevisionShow>}
Who starred in Nothing in Common and produced From the Earth to the Moon?,SELECT DISTINCT ?uri WHERE { <http://dbpedia.org/resource/From_the_Earth_to_the_Moon_(miniseries)> <http://dbpedia.org/ontology/executiveProducer> ?uri. #ent <http://dbpedia.org/property/starring> ?uri . }
 Wringer (novel) and Maniac Magee is the notable work of which author?,SELECT DISTINCT ?uri WHERE { ?uri <http://dbpedia.org/property/notableworks> #ent . ?uri <http://dbpedia.org/property/notableworks> #ent . ?uri <http://www.w3.org/1999/02/22-rdf-syntax-ns#type> <http://dbpedia.org/ontology/Writer>}
What all are written in the C programming language?,SELECT DISTINCT ?uri WHERE {?uri <http://dbpedia.org/property/programmingLanguage> #ent }
What are the artists that have been in the band Framptons camel?,SELECT DISTINCT ?uri WHERE {?uri <http://dbpedia.org/property/associatedActs> #ent  . ?uri <http://www.w3.org/1999/02/22-rdf-syntax-ns#type> <http://dbpedia.org/ontology/Artist>}
Count the number of artists in the Cirque du Soleil discography?,SELECT COUNT(DISTINCT ?uri) WHERE { #ent <http://dbpedia.org/property/artist> ?uri  . }
By which companies is RENFE Class 333 designed?,SELECT DISTINCT ?uri WHERE { #ent <http://dbpedia.org/ontology/designer> ?uri }
Which are the previous broadcast networks of sister channels of WGBC?,SELECT DISTINCT ?uri WHERE { <http://dbpedia.org/resource/WGBC_(DT2)> <http://dbpedia.org/property/sisterStations> ?x . ?x <http://dbpedia.org/ontology/formerBroadcastNetwork> ?uri  . }
What are the movies whose director is Orson Welles?,SELECT DISTINCT ?uri WHERE {?uri <http://dbpedia.org/property/director> #ent  . ?uri <http://www.w3.org/1999/02/22-rdf-syntax-ns#type> <http://dbpedia.org/ontology/Film>}
What is the religion of character of Janice Soprano from The Soprano television show?,SELECT DISTINCT ?uri WHERE { #ent <http://dbpedia.org/ontology/religion> ?uri }
which planet was discovered by Urbain Le Verrier?,SELECT DISTINCT ?uri WHERE {?uri <http://dbpedia.org/ontology/discoverer> #ent }
?What are the airline hubs of Cascade Airways,SELECT DISTINCT ?uri WHERE { #ent <http://dbpedia.org/property/hubs> ?uri }
Where did the editor of Charlie Mensuel die ?,SELECT DISTINCT ?uri WHERE { #ent <http://dbpedia.org/property/editor> ?x . ?x <http://dbpedia.org/property/placeOfDeath> ?uri  . }
Name the chairman of the soccer club for which Mike Salmon currently plays?,SELECT DISTINCT ?uri WHERE { #ent <http://dbpedia.org/property/currentclub> ?x . ?x <http://dbpedia.org/property/chairman> ?uri  . ?x <http://www.w3.org/1999/02/22-rdf-syntax-ns#type> <http://dbpedia.org/ontology/SoccerClub>}
Which Harris County based company is a subsidiary of Tandem Computers?,"SELECT DISTINCT ?uri WHERE {?uri <http://dbpedia.org/ontology/locationCity> <http://dbpedia.org/resource/Harris_County,_Texas> . ?uri <http://dbpedia.org/ontology/subsidiary> #ent  . ?uri <http://www.w3.org/1999/02/22-rdf-syntax-ns#type> <http://dbpedia.org/ontology/Company>}"
What is the common licence of the Frontaccounting and nUbuntu?,SELECT DISTINCT ?uri WHERE { #ent <http://dbpedia.org/ontology/license> ?uri. #ent <http://dbpedia.org/ontology/license> ?uri . }
"What sport is Eric Schiller known for, and employes Craig Van Tibury?",SELECT DISTINCT ?uri WHERE { #ent <http://dbpedia.org/ontology/knownFor> ?uri. #ent <http://dbpedia.org/ontology/occupation> ?uri}
How many rivers are crossed by different Box Girder bridges?,SELECT COUNT(DISTINCT ?uri) WHERE { ?x <http://dbpedia.org/property/design> #ent . ?x <http://dbpedia.org/property/crosses> ?uri  . ?uri <http://www.w3.org/1999/02/22-rdf-syntax-ns#type> <http://dbpedia.org/ontology/River>}
Which Monty Python's movie is distributed by Cinema International Corporation ?,SELECT DISTINCT ?uri WHERE {?uri <http://dbpedia.org/ontology/writer> #ent . ?uri <http://dbpedia.org/property/distributor> #ent  . ?uri <http://www.w3.org/1999/02/22-rdf-syntax-ns#type> <http://dbpedia.org/ontology/Film>}
Was tupac a member of Outlawz?,ASK WHERE { #ent <http://dbpedia.org/property/pastMembers> <http://dbpedia.org/resource/Tupac_Shakur> }
Count the number of members of the organization which have Austria as one of the member ?,SELECT COUNT(DISTINCT ?uri) WHERE { ?x <http://dbpedia.org/property/membership> #ent . ?x <http://dbpedia.org/property/membership> ?uri }
List the other members of the team where Jason Hayne currently plays?,SELECT DISTINCT ?uri WHERE { ?x <http://dbpedia.org/ontology/currentMember> #ent . ?x <http://dbpedia.org/property/name> ?uri  . ?x <http://www.w3.org/1999/02/22-rdf-syntax-ns#type> <http://dbpedia.org/ontology/OrganisationMember>}
Who is married to Susan Weber Soros?,SELECT DISTINCT ?uri WHERE {?uri <http://dbpedia.org/property/spouse> #ent  . }
list  the producer of the movies in which Rosemarie DeWitt in the star cast?,SELECT DISTINCT ?uri WHERE { ?x <http://dbpedia.org/property/starring> #ent . ?x <http://dbpedia.org/property/producer> ?uri  . ?x <http://www.w3.org/1999/02/22-rdf-syntax-ns#type> <http://dbpedia.org/ontology/Film>}
"Which political party of Arunachal Pradesh Legislative Assembly election, 2014 was the leader of Rishikesh ?",SELECT DISTINCT ?uri WHERE { #ent <http://dbpedia.org/property/party> ?uri. #ent <http://dbpedia.org/ontology/leaderName> ?uri}
How many groups have fought in wars where Richard Taylor fought too?,SELECT COUNT(DISTINCT ?uri) WHERE { <http://dbpedia.org/resource/Richard_Taylor_(colonel)> <http://dbpedia.org/property/battles> ?x . ?x <http://dbpedia.org/property/combatant> ?uri  . ?x <http://www.w3.org/1999/02/22-rdf-syntax-ns#type> <http://dbpedia.org/ontology/MilitaryConflict>}
Is Another Lonely Night in New York by the musical band Robin Gibb?,ASK WHERE { #ent <http://dbpedia.org/ontology/musicalBand> #ent }
To which settlement does Elliot Bay belong to?,SELECT DISTINCT ?uri WHERE { #ent <http://dbpedia.org/property/cities> ?uri }
What are the albums whose artists have performed with the Tangerine Dream?,SELECT DISTINCT ?uri WHERE { ?x <http://dbpedia.org/ontology/associatedBand> #ent . ?uri <http://dbpedia.org/property/artist> ?x  . ?uri <http://www.w3.org/1999/02/22-rdf-syntax-ns#type> <http://dbpedia.org/ontology/Album>}
Name the river on Batoka Gorge Hydroelectric Power Station ?,SELECT DISTINCT ?uri WHERE { #ent <http://dbpedia.org/ontology/river> ?uri }
Did chris lebenzon edit Batman returns?,ASK WHERE { #ent <http://dbpedia.org/property/editing> #ent }
Which people are known for appearing on the television show Dragon's Den?,SELECT DISTINCT ?uri WHERE {?uri <http://dbpedia.org/ontology/knownFor> <http://dbpedia.org/resource/Dragons'_Den_(UK_TV_series)>  . ?uri <http://www.w3.org/1999/02/22-rdf-syntax-ns#type> <http://dbpedia.org/ontology/Person>}
What university campuses are situated in Indiana?,SELECT DISTINCT ?uri WHERE {?uri <http://dbpedia.org/ontology/campus> #ent  . ?uri <http://www.w3.org/1999/02/22-rdf-syntax-ns#type> <http://dbpedia.org/ontology/University>}
Who is the authority of Maine School of Science and Mathematics ?,SELECT DISTINCT ?uri WHERE { #ent <http://dbpedia.org/ontology/authority> ?uri }
List some writers which speak one of the Germanic languages.,SELECT DISTINCT ?uri WHERE { ?x <http://dbpedia.org/ontology/languageFamily> #ent . ?uri <http://dbpedia.org/property/language> ?x  . ?uri <http://www.w3.org/1999/02/22-rdf-syntax-ns#type> <http://dbpedia.org/ontology/Writer>}
What are some awards given to people who were born in sweden?,SELECT DISTINCT ?uri WHERE { ?x <http://dbpedia.org/ontology/birthPlace> #ent . ?x <http://dbpedia.org/property/awards> ?uri  . ?x <http://www.w3.org/1999/02/22-rdf-syntax-ns#type> <http://dbpedia.org/ontology/Person>}
ITV employes how many people?,SELECT COUNT(DISTINCT ?uri) WHERE {?uri <http://dbpedia.org/property/employer> <http://dbpedia.org/resource/ITV_(TV_network)>  . }
What band has Joe Hahn and Chester Bennington?,SELECT DISTINCT ?uri WHERE { ?uri <http://dbpedia.org/property/currentMembers> #ent . ?uri <http://dbpedia.org/property/currentMembers> #ent . ?uri <http://www.w3.org/1999/02/22-rdf-syntax-ns#type> <http://dbpedia.org/ontology/Band>}
Is the assembly of tofa ahin ethopia?,ASK WHERE { #ent <http://dbpedia.org/ontology/assembly> #ent }
Was the street dogs of south central narrated by Queen Latifah?,ASK WHERE { #ent <http://dbpedia.org/property/narrator> #ent }
Name some schools with a bison as their mascot?,SELECT DISTINCT ?uri WHERE {?uri <http://dbpedia.org/property/mascot> #ent  . ?uri <http://www.w3.org/1999/02/22-rdf-syntax-ns#type> <http://dbpedia.org/ontology/School>}
What has Carl Sagan written his books about?,SELECT DISTINCT ?uri WHERE { ?x <http://dbpedia.org/ontology/author> #ent . ?x <http://dbpedia.org/property/subject> ?uri  . ?x <http://www.w3.org/1999/02/22-rdf-syntax-ns#type> <http://dbpedia.org/ontology/Book>}
In which state does the university which is the alma mater of Mateusz Morawiecki lie?,SELECT DISTINCT ?uri WHERE { #ent <http://dbpedia.org/property/almaMater> ?x . ?x <http://dbpedia.org/property/state> ?uri  . ?x <http://www.w3.org/1999/02/22-rdf-syntax-ns#type> <http://dbpedia.org/ontology/University>}
Who voiced in Peanuts Motion Comics and The Peanuts Movie?,SELECT DISTINCT ?uri WHERE { ?uri <http://dbpedia.org/ontology/voice> #ent . ?uri <http://dbpedia.org/ontology/voice> #ent . }
Who is the owner of the bank where Thomas Secunda works ?,SELECT DISTINCT ?uri WHERE { #ent <http://dbpedia.org/ontology/occupation> ?x . ?x <http://dbpedia.org/property/owner> ?uri  . ?x <http://www.w3.org/1999/02/22-rdf-syntax-ns#type> <http://dbpedia.org/ontology/Bank>}
What are some US citizens famous for?,SELECT DISTINCT ?uri WHERE { ?x <http://dbpedia.org/ontology/nationality> <http://dbpedia.org/resource/United_States> . ?x <http://dbpedia.org/ontology/knownFor> ?uri  . }
Who founded a company which served Mid Wales ?,SELECT DISTINCT ?uri WHERE { ?x <http://dbpedia.org/ontology/regionServed> #ent . ?x <http://dbpedia.org/ontology/foundedBy> ?uri  . }
British people have edited which movies?,SELECT DISTINCT ?uri WHERE { ?x <http://dbpedia.org/ontology/birthPlace> <http://dbpedia.org/resource/United_Kingdom> . ?uri <http://dbpedia.org/property/editing> ?x  . ?uri <http://www.w3.org/1999/02/22-rdf-syntax-ns#type> <http://dbpedia.org/ontology/Film>}
Who is the leader of the town where the Myntdu river originates?,SELECT DISTINCT ?uri WHERE { #ent <http://dbpedia.org/ontology/origin> ?x . ?x <http://dbpedia.org/ontology/leaderName> ?uri  . ?x <http://www.w3.org/1999/02/22-rdf-syntax-ns#type> <http://dbpedia.org/ontology/Town>}
List the home town of the bands whose label is Alive Naturalsound Records ?,SELECT DISTINCT ?uri WHERE { ?x <http://dbpedia.org/property/label> #ent . ?x <http://dbpedia.org/ontology/hometown> ?uri  . ?x <http://www.w3.org/1999/02/22-rdf-syntax-ns#type> <http://dbpedia.org/ontology/Band>}
Which broad cast area od CFRX is the country of North America Poker Tour ?,SELECT DISTINCT ?uri WHERE { #ent <http://dbpedia.org/ontology/broadcastArea> ?uri. #ent <http://dbpedia.org/ontology/country> ?uri}
List the subsequent work of the albums whose one of the subsequent work is Planet Waves?,SELECT DISTINCT ?uri WHERE { ?x <http://dbpedia.org/ontology/subsequentWork> #ent . ?x <http://dbpedia.org/ontology/subsequentWork> ?uri  . ?x <http://www.w3.org/1999/02/22-rdf-syntax-ns#type> <http://dbpedia.org/ontology/Album>}
Name some basketball players whose team is coached by Fred Hoiberg?,SELECT DISTINCT ?uri WHERE { ?x <http://dbpedia.org/ontology/coach> #ent . ?uri <http://dbpedia.org/property/team> ?x  . ?uri <http://www.w3.org/1999/02/22-rdf-syntax-ns#type> <http://dbpedia.org/ontology/BasketballPlayer>}
Give me some administrators of bridges over which cars can go?,SELECT DISTINCT ?uri WHERE { ?x <http://dbpedia.org/property/carries> <http://dbpedia.org/resource/Motor_vehicle> . ?x <http://dbpedia.org/ontology/maintainedBy> ?uri  . ?x <http://www.w3.org/1999/02/22-rdf-syntax-ns#type> <http://dbpedia.org/ontology/Bridge>}
Who are some US colonels?,SELECT DISTINCT ?uri WHERE {?uri <http://dbpedia.org/property/rank> <http://dbpedia.org/resource/Colonel_(United_States)>  . }
Where did Meg McGuffin graduated ?,SELECT DISTINCT ?uri WHERE { #ent <http://dbpedia.org/ontology/education> ?uri }
Was Citizen Kane cinematographed by Gregg Toland?,ASK WHERE { #ent <http://dbpedia.org/property/cinematography> #ent }
Count the different alma maters of people employed by the CNN,SELECT COUNT(DISTINCT ?uri) WHERE { ?x <http://dbpedia.org/property/employer> #ent . ?x <http://dbpedia.org/ontology/almaMater> ?uri  . }
What are the awards won by the person who is an authority of Latania verschaffeltii ?,SELECT DISTINCT ?uri WHERE { #ent <http://dbpedia.org/property/binomialAuthority> ?x . ?x <http://dbpedia.org/property/awards> ?uri  . ?x <http://www.w3.org/1999/02/22-rdf-syntax-ns#type> <http://dbpedia.org/ontology/Person>}
Where did Steve Romeo dies ?,SELECT DISTINCT ?uri WHERE { #ent <http://dbpedia.org/ontology/deathPlace> ?uri }
How many universities are in the National Collegiate Athletic Association?,SELECT COUNT(DISTINCT ?uri) WHERE {?uri <http://dbpedia.org/ontology/athletics> #ent  . }
Which company developed the language designed by Lars Bak?,SELECT DISTINCT ?uri WHERE { ?x <http://dbpedia.org/ontology/designer> <http://dbpedia.org/resource/Lars_Bak_(computer_programmer)> . ?x <http://dbpedia.org/property/developer> ?uri  . ?x <http://www.w3.org/1999/02/22-rdf-syntax-ns#type> <http://dbpedia.org/ontology/Language>}
What is the mascot of the army unit whose commander is Peter Cosgrove ?,SELECT DISTINCT ?uri WHERE { ?x <http://dbpedia.org/property/commander> #ent . ?x <http://dbpedia.org/property/mascot> ?uri  . ?x <http://www.w3.org/1999/02/22-rdf-syntax-ns#type> <http://dbpedia.org/ontology/MilitaryUnit>}
What is the common citizenship between JSM Hopoer and Robert Valentine ?, SELECT DISTINCT ?uri WHERE { <http://dbpedia.org/resource/J._S._M._Hooper> <http://dbpedia.org/ontology/citizenship> ?uri. <http://dbpedia.org/resource/Robert_Valentine_(composer)> <http://dbpedia.org/ontology/country> ?uri} 
Which country gave birth to the Lemberger LD20b and Start+Flug H101 aircrafts?,SELECT DISTINCT ?uri WHERE { #ent <http://dbpedia.org/property/nationalOrigin> ?uri. <http://dbpedia.org/resource/Start_+_Flug_H-101> <http://dbpedia.org/property/nationalOrigin> ?uri . }
Which religion followers are the members of Janata Dal?,SELECT DISTINCT ?uri WHERE { ?x <http://dbpedia.org/property/party> #ent . ?x <http://dbpedia.org/ontology/religion> ?uri  . }
Where are INKAS located which is also the state of origin for Jojo Chintoh ?,SELECT DISTINCT ?uri WHERE { #ent <http://dbpedia.org/ontology/stateOfOrigin> ?uri. #ent <http://dbpedia.org/property/locations> ?uri}
What is the workplace of Christopher S. Stewart ?,SELECT DISTINCT ?uri WHERE { #ent <http://dbpedia.org/property/employer> ?uri }
What are some things people born in Louisiana are famous for?,SELECT COUNT(DISTINCT ?uri) WHERE { ?x <http://dbpedia.org/property/placeOfBirth> #ent . ?x <http://dbpedia.org/property/knownFor> ?uri  . }
Where did Fort Lauderdale Strikers season of 16 take place?, SELECT DISTINCT ?uri WHERE { <http://dbpedia.org/resource/2016_Fort_Lauderdale_Strikers_season> <http://dbpedia.org/ontology/ground> ?uri } 
"Who is the founder of Hohenau, Paraguay?",SELECT DISTINCT ?uri WHERE { #ent <http://dbpedia.org/ontology/founder> ?uri }
Who gave the musical score  of 9 to 5 (musical) ?,SELECT DISTINCT ?uri WHERE { #ent <http://dbpedia.org/ontology/musicBy> ?uri }
Who are the spouse of the actors of Wrongfully Accused?,SELECT DISTINCT ?uri WHERE { #ent <http://dbpedia.org/ontology/starring> ?x . ?x <http://dbpedia.org/ontology/spouse> ?uri  . }
Count all that was built by a company whose leader is Kazuo Hirai?,SELECT COUNT(DISTINCT ?uri) WHERE { ?x <http://dbpedia.org/property/keyPeople> #ent . ?uri <http://dbpedia.org/ontology/manufacturer> ?x  . }
Which producer of Wizards and the aliens is also the notable work of russell T Davies ?,SELECT DISTINCT ?uri WHERE { <http://dbpedia.org/resource/Wizards_vs_Aliens> <http://dbpedia.org/ontology/producer> ?uri. #ent <http://dbpedia.org/ontology/notableWork> ?uri}
Which coach of England national under 21 footbal team is also the coach of Aston Villa F.C season ?,SELECT DISTINCT ?uri WHERE { #ent <http://dbpedia.org/property/coach> ?uri. <http://dbpedia.org/resource/200001_Aston_Villa_F.C._season> <http://dbpedia.org/property/name> ?uri}
For which band did Dave Hollister perform in the past?,SELECT DISTINCT ?uri WHERE {?uri <http://dbpedia.org/property/pastMembers> #ent }
Name the scientist who is known for inventing Anthrax and was a member of Royal Society?,SELECT DISTINCT ?uri WHERE {?uri <http://dbpedia.org/ontology/knownFor> #ent . ?uri <http://dbpedia.org/property/prizes> #ent  . ?uri <http://www.w3.org/1999/02/22-rdf-syntax-ns#type> <http://dbpedia.org/ontology/Scientist>}
