Which board game can be said as a mind based game?,SELECT DISTINCT ?uri WHERE { ?uri <http://dbpedia.org/ontology/genre> #ent . ?uri <http://dbpedia.org/ontology/genre> <http://dbpedia.org/resource/Mind_sport> . }
"Where are the philosophers from, whose main work is on the matter of feminism in Canada?",SELECT DISTINCT ?uri WHERE { ?x <http://dbpedia.org/ontology/mainInterest> #ent . ?x <http://dbpedia.org/property/region> ?uri  . ?x <http://www.w3.org/1999/02/22-rdf-syntax-ns#type> <http://dbpedia.org/ontology/Philosopher>}
What are the things built by Eristoff ?,SELECT DISTINCT ?uri WHERE { #ent <http://dbpedia.org/property/manufacturer> ?uri }
What is the official residence of Sarah Kazemy ?,SELECT DISTINCT ?uri WHERE { #ent <http://dbpedia.org/property/residence> ?uri }
What are shows whose theme music composer's home town is New York?,SELECT DISTINCT ?uri WHERE { ?x <http://dbpedia.org/ontology/hometown> #ent . ?uri <http://dbpedia.org/property/themeMusicComposer> ?x  . ?uri <http://www.w3.org/1999/02/22-rdf-syntax-ns#type> <http://dbpedia.org/ontology/TelevisionShow>}
"Name the university whose affiliations's foundation is in Washington, D.C.?",SELECT DISTINCT ?uri WHERE { ?x <http://dbpedia.org/property/foundation> #ent . ?uri <http://dbpedia.org/property/affiliations> ?x  . ?uri <http://www.w3.org/1999/02/22-rdf-syntax-ns#type> <http://dbpedia.org/ontology/University>}
Who was the coach of 1972 Oakland Raiders season ?,SELECT DISTINCT ?uri WHERE { #ent <http://dbpedia.org/ontology/coach> ?uri }
Whcih land of Citi Trends is also the constituency of Malik Al-Hassan Yakubu ?,SELECT DISTINCT ?uri WHERE { #ent <http://dbpedia.org/property/constituency> ?uri. <http://dbpedia.org/resource/CitiTrends_(radio_show)> <http://dbpedia.org/ontology/country> ?uri}
Which TV show's composer is Judy  Hart  Angelo and executive producer as Glen and Les Charles?,SELECT DISTINCT ?uri WHERE {?uri <http://dbpedia.org/ontology/composer> #ent . ?uri <http://dbpedia.org/ontology/executiveProducer> #ent  . ?uri <http://www.w3.org/1999/02/22-rdf-syntax-ns#type> <http://dbpedia.org/ontology/TelevisionShow>}
"Where did they debut their careers , those who have played for US men's national soccer team?",SELECT DISTINCT ?uri WHERE { ?x <http://dbpedia.org/property/nationalteam> <http://dbpedia.org/resource/United_States_men's_national_soccer_team> . ?x <http://dbpedia.org/property/debutteam> ?uri  . }
What are on the borders of Shimsa Plateau?,SELECT DISTINCT ?uri WHERE { #ent <http://dbpedia.org/ontology/border> ?uri }
What is the former team of the american football players whose position is Running back?,SELECT DISTINCT ?uri WHERE { ?x <http://dbpedia.org/ontology/position> #ent . ?x <http://dbpedia.org/ontology/formerTeam> ?uri  . ?x <http://www.w3.org/1999/02/22-rdf-syntax-ns#type> <http://dbpedia.org/ontology/AmericanFootballPlayer>}
Which creator of Theme Time Radio Hour has also given the  musical score of the The Times They Are a-Changin' (musical)?,SELECT DISTINCT ?uri WHERE { #ent <http://dbpedia.org/property/creator> ?uri. #ent <http://dbpedia.org/ontology/musicBy> ?uri}
How many different kinds of games are published by Interplay Entertainment?,SELECT COUNT(DISTINCT ?uri) WHERE { ?x <http://dbpedia.org/ontology/publisher> #ent . ?x <http://dbpedia.org/property/genre> ?uri  . }
What other awards have been given to Goya Award Winners?,SELECT DISTINCT ?uri WHERE { ?x <http://dbpedia.org/ontology/award> #ent . ?x <http://dbpedia.org/property/awards> ?uri  . }
How many other important work has been done by the writers of Sarah Jane Adventures?,SELECT COUNT(DISTINCT ?uri) WHERE { ?x <http://dbpedia.org/property/notableworks> #ent . ?x <http://dbpedia.org/ontology/notableWork> ?uri  . }
Race horses whose grandsire is Wild  Risk have taken part in which races?,SELECT DISTINCT ?uri WHERE { ?x <http://dbpedia.org/ontology/grandsire> #ent . ?x <http://dbpedia.org/property/race> ?uri  . ?x <http://www.w3.org/1999/02/22-rdf-syntax-ns#type> <http://dbpedia.org/ontology/RaceHorse>}
Who are the tenants of the stadium which is a venue of WCW Mayhem ?,SELECT DISTINCT ?uri WHERE { #ent <http://dbpedia.org/property/venue> ?x . ?x <http://dbpedia.org/ontology/tenant> ?uri  . ?x <http://www.w3.org/1999/02/22-rdf-syntax-ns#type> <http://dbpedia.org/ontology/Stadium>}
Which coach of Marquette Golden Eagles men's basketball team is also the head coach  of Virginia Tech Hokies men's basketball team ?, SELECT DISTINCT ?uri WHERE { <http://dbpedia.org/resource/201415_Virginia_Tech_Hokies_men's_basketball_team> <http://dbpedia.org/property/headcoach> ?uri. <http://dbpedia.org/resource/201213_Marquette_Golden_Eagles_men's_basketball_team> <http://dbpedia.org/ontology/coach> ?uri} 
Which are the races in which Martin Molony participated?,SELECT DISTINCT ?uri WHERE { #ent <http://dbpedia.org/ontology/race> ?uri }
With what company is the service OneDrive associated?,SELECT DISTINCT ?uri WHERE {?uri <http://dbpedia.org/property/services> #ent  . ?uri <http://www.w3.org/1999/02/22-rdf-syntax-ns#type> <http://dbpedia.org/ontology/Company>}
Where common region are soylent and bannock sold?,SELECT DISTINCT ?uri WHERE { <http://dbpedia.org/resource/Soylent_(drink)> <http://dbpedia.org/ontology/region> ?uri. <http://dbpedia.org/resource/Bannock_(food)> <http://dbpedia.org/ontology/region> ?uri . }
What awards have been given to citizens of the Ottoman Empire?,SELECT DISTINCT ?uri WHERE { ?x <http://dbpedia.org/ontology/citizenship> #ent . ?x <http://dbpedia.org/ontology/award> ?uri  . }
List the science fiction shows broadcasted on BBC HD ?,SELECT DISTINCT ?uri WHERE {?uri <http://dbpedia.org/property/genre> #ent . ?uri <http://dbpedia.org/ontology/network> #ent  . ?uri <http://www.w3.org/1999/02/22-rdf-syntax-ns#type> <http://dbpedia.org/ontology/TelevisionShow>}
Who is the person opposed  by Tom McLaury and Ike Clanton?,SELECT DISTINCT ?uri WHERE { ?uri <http://dbpedia.org/ontology/opponent> #ent . ?uri <http://dbpedia.org/ontology/opponent> #ent . ?uri <http://www.w3.org/1999/02/22-rdf-syntax-ns#type> <http://dbpedia.org/ontology/Person>}
List the products of Playboy Enterprises?,SELECT DISTINCT ?uri WHERE { #ent <http://dbpedia.org/property/products> ?uri }
Name the  former broadcast network of the television station which is the sister stations of WGBC?,SELECT DISTINCT ?uri WHERE { #ent <http://dbpedia.org/property/sisterStations> ?x . ?x <http://dbpedia.org/ontology/formerBroadcastNetwork> ?uri  . }
What is the country of the Hirth Acrostar and the Cobra missile?,SELECT DISTINCT ?uri WHERE { #ent <http://dbpedia.org/ontology/origin> ?uri. #ent <http://dbpedia.org/ontology/origin> ?uri . }
What  is the Nickname of Daniel O'Regan ?,SELECT DISTINCT ?uri WHERE { #ent <http://dbpedia.org/property/nickname> ?uri }
Who owns the websites for which Jimmy wales writes?,SELECT DISTINCT ?uri WHERE { ?x <http://dbpedia.org/ontology/author> #ent . ?x <http://dbpedia.org/ontology/owner> ?uri  . }
What are the bridges whose located in California?,SELECT DISTINCT ?uri WHERE {?uri <http://dbpedia.org/ontology/locatedInArea> #ent  . ?uri <http://www.w3.org/1999/02/22-rdf-syntax-ns#type> <http://dbpedia.org/ontology/Bridge>}
Which settelment area is the home town of the Danny Felice and Cline Buckens?,SELECT DISTINCT ?uri WHERE { #ent <http://dbpedia.org/ontology/hometown> ?uri. #ent <http://dbpedia.org/ontology/hometown> ?uri . ?uri <http://www.w3.org/1999/02/22-rdf-syntax-ns#type> <http://dbpedia.org/ontology/Settlement>}
Who were the head of government agencies working in the German occupied Europe?,SELECT DISTINCT ?uri WHERE { ?x <http://dbpedia.org/property/jurisdiction> #ent . ?x <http://dbpedia.org/ontology/leader> ?uri  . ?x <http://www.w3.org/1999/02/22-rdf-syntax-ns#type> <http://dbpedia.org/ontology/GovernmentAgency>}
Name the companies which are in cities under Denzil Minnan Wong?,SELECT DISTINCT ?uri WHERE { ?x <http://dbpedia.org/property/leaderName> #ent . ?uri <http://dbpedia.org/ontology/locationCity> ?x  . ?uri <http://www.w3.org/1999/02/22-rdf-syntax-ns#type> <http://dbpedia.org/ontology/Company>}
What is the largest city of the birthplace of Pat Kirkwood?,SELECT DISTINCT ?uri WHERE { <http://dbpedia.org/resource/Pat_Kirkwood_(racing_driver)> <http://dbpedia.org/property/birthplace> ?x . ?x <http://dbpedia.org/ontology/largestCity> ?uri  . }
Which source of Water resources management in El Salvador is also the nation of the Sierra del Merendn?,SELECT DISTINCT ?uri WHERE { #ent <http://dbpedia.org/property/sourceCountry> ?uri. #ent <http://dbpedia.org/ontology/country> ?uri}
What is the academic journal whose editor is Stephen Law?,SELECT DISTINCT ?uri WHERE {?uri <http://dbpedia.org/property/editor> #ent  . ?uri <http://www.w3.org/1999/02/22-rdf-syntax-ns#type> <http://dbpedia.org/ontology/AcademicJournal>}
What awards have the alumni of Academy of Fine Arts in Lodz achieved?,SELECT DISTINCT ?uri WHERE { ?x <http://dbpedia.org/ontology/training> <http://dbpedia.org/resource/Academy_of_Fine_Arts_In_d> . ?x <http://dbpedia.org/ontology/award> ?uri  . }
Name the members of youth clubs which have Camp Nou as their homeground.,SELECT DISTINCT ?uri WHERE { ?x <http://dbpedia.org/property/ground> #ent . ?uri <http://dbpedia.org/property/youthclubs> ?x  . }
Does mumbai manage the railway line going to the daund railway junction?,ASK WHERE { <http://dbpedia.org/resource/Daund_Junction_railway_station> <http://dbpedia.org/ontology/servingRailwayLine> #ent }
Which musical artist associated with Tony Allen has label with Celluloid Records ?,SELECT DISTINCT ?uri WHERE {?uri <http://dbpedia.org/ontology/associatedMusicalArtist> <http://dbpedia.org/resource/Tony_Allen_(musician)> . ?uri <http://dbpedia.org/property/label> #ent  . ?uri <http://www.w3.org/1999/02/22-rdf-syntax-ns#type> <http://dbpedia.org/ontology/MusicalArtist>}
Who are some basketball players who played for Phoenix Suns?,SELECT DISTINCT ?uri WHERE {?uri <http://dbpedia.org/ontology/team> #ent  . ?uri <http://www.w3.org/1999/02/22-rdf-syntax-ns#type> <http://dbpedia.org/ontology/BasketballPlayer>}
"Which relative of George Madison was the leader of United States House of Representatives elections, 1788 and 1789 ?",SELECT DISTINCT ?uri WHERE { #ent <http://dbpedia.org/ontology/relation> ?uri. #ent <http://dbpedia.org/property/leader> ?uri}
"From how many works is the musical derived, whose lyrics are written by Sheldon Harnick?",SELECT COUNT(DISTINCT ?uri) WHERE { ?x <http://dbpedia.org/property/lyrics> #ent . ?x <http://dbpedia.org/ontology/basedOn> ?uri  . }
Which office holder allegiance is Colony of Virginia and was has a wife named Dolley Madison ?,SELECT DISTINCT ?uri WHERE {?uri <http://dbpedia.org/property/spouse> #ent . ?uri <http://dbpedia.org/property/allegiance> #ent  . ?uri <http://www.w3.org/1999/02/22-rdf-syntax-ns#type> <http://dbpedia.org/ontology/OfficeHolder>}
Was Derg the anthem of Ethopia?,ASK WHERE { #ent <http://dbpedia.org/ontology/anthem> #ent }
Employees of Ottawa Citizen have come from which towns?,SELECT DISTINCT ?uri WHERE { ?x <http://dbpedia.org/ontology/employer> #ent . ?x <http://dbpedia.org/property/homeTown> ?uri  . }
How many non-fiction subject are there of the books whose one of the non-fiction subject is Ankh-Morpork City Watch ?,SELECT COUNT(DISTINCT ?uri) WHERE { ?x <http://dbpedia.org/ontology/nonFictionSubject> #ent . ?x <http://dbpedia.org/ontology/nonFictionSubject> ?uri }
Who is the licensee of EXXV-TV ?,SELECT DISTINCT ?uri WHERE { #ent <http://dbpedia.org/property/licensee> ?uri }
Who are in the board of Jimmy Wales ?,SELECT DISTINCT ?uri WHERE { #ent <http://dbpedia.org/ontology/board> ?uri }
Where were some people associated with Steve Winwood employed at?,SELECT DISTINCT ?uri WHERE { ?x <http://dbpedia.org/ontology/associatedMusicalArtist> #ent . ?x <http://dbpedia.org/ontology/occupation> ?uri  . ?x <http://www.w3.org/1999/02/22-rdf-syntax-ns#type> <http://dbpedia.org/ontology/Person>}
What is the origin of the musical artist whose associated band is Ziggi Recado ?,SELECT DISTINCT ?uri WHERE { ?x <http://dbpedia.org/ontology/associatedBand> #ent . ?x <http://dbpedia.org/property/origin> ?uri  . ?x <http://www.w3.org/1999/02/22-rdf-syntax-ns#type> <http://dbpedia.org/ontology/MusicalArtist>}
Who is the nominee of Jack Ryan ?, SELECT DISTINCT ?uri WHERE { <http://dbpedia.org/resource/Jack_Ryan_(politician)> <http://dbpedia.org/ontology/nominee> ?uri } 
Which division of Serbia national team is also the region of Dobinsk Ice Cave ?,SELECT DISTINCT ?uri WHERE { <http://dbpedia.org/resource/Serbia_national_American_football_team> <http://dbpedia.org/ontology/division> ?uri. #ent <http://dbpedia.org/ontology/region> ?uri}
Name the royalty whose spouse was Cleopatra V of Egypt and one of his parent was Ptolemy XII Auletes?,SELECT DISTINCT ?uri WHERE {?uri <http://dbpedia.org/property/mother> #ent . ?uri <http://dbpedia.org/ontology/parent> #ent  . ?uri <http://www.w3.org/1999/02/22-rdf-syntax-ns#type> <http://dbpedia.org/ontology/Royalty>}
List the major shrines of Jovan Vladimir?,SELECT DISTINCT ?uri WHERE { #ent <http://dbpedia.org/property/majorShrine> ?uri }
Name some shows whose company is owned by the CBS Corporation?,SELECT DISTINCT ?uri WHERE { ?x <http://dbpedia.org/ontology/owner> #ent . ?uri <http://dbpedia.org/property/company> ?x  . ?uri <http://www.w3.org/1999/02/22-rdf-syntax-ns#type> <http://dbpedia.org/ontology/TelevisionShow>}
"Which famous person is born in Marlboro Township, New Jersey?",SELECT DISTINCT ?uri WHERE {?uri <http://dbpedia.org/property/homeTown> #ent  . }
In which countries have the Start + Flug aircrafts originated?,SELECT DISTINCT ?uri WHERE { ?x <http://dbpedia.org/ontology/manufacturer> #ent . ?x <http://dbpedia.org/property/nationalOrigin> ?uri  . ?x <http://www.w3.org/1999/02/22-rdf-syntax-ns#type> <http://dbpedia.org/ontology/Aircraft>}
How many other family of the mammals exists  whose family is also Hominidae ?,SELECT COUNT(DISTINCT ?uri) WHERE { ?x <http://dbpedia.org/ontology/family> #ent . ?x <http://dbpedia.org/ontology/family> ?uri }
What is the former team of the football player who is the coach of 2006 Oakland Raiders season ?,SELECT DISTINCT ?uri WHERE { #ent <http://dbpedia.org/property/coach> ?x . ?x <http://dbpedia.org/ontology/formerTeam> ?uri  . ?x <http://www.w3.org/1999/02/22-rdf-syntax-ns#type> <http://dbpedia.org/ontology/AmericanFootballPlayer>}
How many  TV shows were made by someone who was associated with Lewis Hamilton?,SELECT COUNT(DISTINCT ?uri) WHERE { ?x <http://dbpedia.org/ontology/associatedBand> #ent . ?uri <http://dbpedia.org/property/creator> ?x  . ?uri <http://www.w3.org/1999/02/22-rdf-syntax-ns#type> <http://dbpedia.org/ontology/TelevisionShow>}
For how many other teams have the former players of Boston Bruins played?,SELECT COUNT(DISTINCT ?uri) WHERE { ?x <http://dbpedia.org/ontology/formerTeam> #ent . ?x <http://dbpedia.org/property/playedFor> ?uri  . ?uri <http://www.w3.org/1999/02/22-rdf-syntax-ns#type> <http://dbpedia.org/ontology/SportsTeam>}
Which things have been made by artists who died in Midhurst?,SELECT DISTINCT ?uri WHERE { ?x <http://dbpedia.org/ontology/deathPlace> #ent . ?uri <http://dbpedia.org/ontology/creator> ?x  . }
What are the TV shows whose network is also known as the CW?,SELECT DISTINCT ?uri WHERE { ?x <http://dbpedia.org/property/sisterNames> #ent . ?uri <http://dbpedia.org/property/network> ?x  . ?uri <http://www.w3.org/1999/02/22-rdf-syntax-ns#type> <http://dbpedia.org/ontology/TelevisionShow>}
How many other important things has the painter of Sarah Jane Adventures done?,SELECT COUNT(DISTINCT ?uri) WHERE { <http://dbpedia.org/resource/The_Sarah_Jane_Adventures> <http://dbpedia.org/property/creator> ?x . ?x <http://dbpedia.org/ontology/notableWork> ?uri  . }
Which founder of sea Gayle Music is also the judge of Rising Star ?,SELECT DISTINCT ?uri WHERE { #ent <http://dbpedia.org/property/founder> ?uri. <http://dbpedia.org/resource/Rising_Star_(U.S._TV_series)> <http://dbpedia.org/property/judges> ?uri}
Who owns the ford kansas assembly plant?, SELECT DISTINCT ?uri WHERE { <http://dbpedia.org/resource/Ford_Kansas_City_Assembly_Plant> <http://dbpedia.org/ontology/owningOrganisation> ?uri } 
What is the label of I Pray on Christmas ?,SELECT DISTINCT ?uri WHERE { #ent <http://dbpedia.org/property/label> ?uri }
List the destination of Novair International Airways ?,SELECT DISTINCT ?uri WHERE { #ent <http://dbpedia.org/ontology/destination> ?uri }
Who is the spouse of Willian Menalaus?,SELECT DISTINCT ?uri WHERE { #ent <http://dbpedia.org/ontology/spouse> ?uri }
Count the number of actors in Lucy Sullivan Is Getting Married.,SELECT COUNT(DISTINCT ?uri) WHERE { #ent <http://dbpedia.org/property/starring> ?uri  . }
What mammals are classified into Diprotodontia ?,SELECT DISTINCT ?uri WHERE {?uri <http://dbpedia.org/ontology/order> #ent  . ?uri <http://www.w3.org/1999/02/22-rdf-syntax-ns#type> <http://dbpedia.org/ontology/Mammal>}
The Other Side has hosted how many guests?,SELECT COUNT(DISTINCT ?uri) WHERE { <http://dbpedia.org/resource/The_Other_Side_(The_Outer_Limits)> <http://dbpedia.org/property/guests> ?uri  . }
Name the river with source as Columbia Lake and river mouth is located in Clatsop Country ?,"SELECT DISTINCT ?uri WHERE {?uri <http://dbpedia.org/ontology/riverMouth> <http://dbpedia.org/resource/Clatsop_County,_Oregon> . ?uri <http://dbpedia.org/ontology/source> #ent  . ?uri <http://www.w3.org/1999/02/22-rdf-syntax-ns#type> <http://dbpedia.org/ontology/River>}"
Is Dave Schulz a band member of Berlin?,ASK WHERE { <http://dbpedia.org/resource/Berlin_(band)> <http://dbpedia.org/ontology/bandMember> <http://dbpedia.org/resource/Dave_Schulz_(musician)> }
What are the airlines whose hub airport is Los Angeles International Airport?,SELECT DISTINCT ?uri WHERE {?uri <http://dbpedia.org/ontology/hubAirport> #ent  . ?uri <http://www.w3.org/1999/02/22-rdf-syntax-ns#type> <http://dbpedia.org/ontology/Airline>}
what are some famous people out of the Filipinos?,SELECT DISTINCT ?uri WHERE {?uri <http://dbpedia.org/ontology/stateOfOrigin> #ent }
What awards were presented to the person who produced Paradise place?,SELECT DISTINCT ?uri WHERE { #ent <http://dbpedia.org/property/producer> ?x . ?x <http://dbpedia.org/property/awards> ?uri  . ?x <http://www.w3.org/1999/02/22-rdf-syntax-ns#type> <http://dbpedia.org/ontology/Person>}
What is the location town of Seattle Great Wheel ?,SELECT DISTINCT ?uri WHERE { #ent <http://dbpedia.org/property/locationTown> ?uri }
List all the line of Vadodara Junction railway station?,SELECT DISTINCT ?uri WHERE { #ent <http://dbpedia.org/property/line> ?uri }
Name the college of Jon Curran ?,SELECT DISTINCT ?uri WHERE { #ent <http://dbpedia.org/property/college> ?uri }
Which Tim Birton's movie has a screenplay by Daniel Waters ?,SELECT DISTINCT ?uri WHERE {?uri <http://dbpedia.org/property/screenplay> <http://dbpedia.org/resource/Daniel_Waters_(screenwriter)> . ?uri <http://dbpedia.org/property/director> #ent  . }
Who produces the tv series which made Scott Haran famous?,SELECT DISTINCT ?uri WHERE { #ent <http://dbpedia.org/ontology/knownFor> ?x . ?x <http://dbpedia.org/ontology/producer> ?uri  . }
What is the place of birth of the jockey who breeded De La Rose ?,SELECT DISTINCT ?uri WHERE { #ent <http://dbpedia.org/ontology/breeder> ?x . ?x <http://dbpedia.org/property/birthPlace> ?uri  . ?x <http://www.w3.org/1999/02/22-rdf-syntax-ns#type> <http://dbpedia.org/ontology/Jockey>}
Name the Artist of Madagascar: Operation Penguin ?,SELECT DISTINCT ?uri WHERE { #ent <http://dbpedia.org/property/artist> ?uri }
What are some devices made by Taiwanese companies?,SELECT DISTINCT ?uri WHERE { ?x <http://dbpedia.org/property/locationCity> <http://dbpedia.org/resource/Taiwan> . ?uri <http://dbpedia.org/ontology/manufacturer> ?x  . ?uri <http://www.w3.org/1999/02/22-rdf-syntax-ns#type> <http://dbpedia.org/ontology/Device>}
Harry Huston and Dick Spalding played their first match for which team?,SELECT DISTINCT ?uri WHERE { #ent <http://dbpedia.org/property/debutteam> ?uri. #ent <http://dbpedia.org/property/debutteam> ?uri . }
What is the layout of Subaru Legacy (second generation) ?,SELECT DISTINCT ?uri WHERE { #ent <http://dbpedia.org/ontology/layout> ?uri }
How many other wine region are there of the grapes whose one of the wine region is Michigan ?,SELECT COUNT(DISTINCT ?uri) WHERE { ?x <http://dbpedia.org/ontology/wineRegion> #ent . ?x <http://dbpedia.org/ontology/wineRegion> ?uri }
Name the office holder whose constituency are Duboce Triangle and Haight-Ashbury ?,"SELECT DISTINCT ?uri WHERE { ?uri <http://dbpedia.org/property/constituency> <http://dbpedia.org/resource/Duboce_Triangle,_San_Francisco> . ?uri <http://dbpedia.org/property/constituency> #ent . ?uri <http://www.w3.org/1999/02/22-rdf-syntax-ns#type> <http://dbpedia.org/ontology/OfficeHolder>}"
Estimate the number of sports divisions at the universities under international association of universities.,SELECT COUNT(DISTINCT ?uri) WHERE { ?x <http://dbpedia.org/ontology/affiliation> #ent . ?x <http://dbpedia.org/ontology/sport> ?uri  . }
What is the leader of the government agency which is the military unit of Erich Kempka ?,SELECT DISTINCT ?uri WHERE { #ent <http://dbpedia.org/ontology/militaryUnit> ?x . ?x <http://dbpedia.org/ontology/leader> ?uri  . }
What is the alma mater of the senator who is the successor of Warren Magnuson ?,SELECT DISTINCT ?uri WHERE { #ent <http://dbpedia.org/property/successor> ?x . ?x <http://dbpedia.org/property/almaMater> ?uri  . ?x <http://www.w3.org/1999/02/22-rdf-syntax-ns#type> <http://dbpedia.org/ontology/Senator>}
Is Eddie Bravo the trainer of Shinya Aoki?,ASK WHERE { #ent <http://dbpedia.org/property/trainer> #ent }
List the battles in which alumni of US Army Command and General Staff College fought?,SELECT DISTINCT ?uri WHERE { ?x <http://dbpedia.org/ontology/almaMater> <http://dbpedia.org/resource/United_States_Army_Command_and_General_Staff_College> . ?x <http://dbpedia.org/property/battles> ?uri  . }
Which writer of Alan Freeman Days is also the writer of Come On over ?,SELECT DISTINCT ?uri WHERE { #ent <http://dbpedia.org/ontology/writer> ?uri. <http://dbpedia.org/resource/Come_On_Over_(Bee_Gees_song)> <http://dbpedia.org/property/writer> ?uri}
Name the subsidary of Tandem Computers which was founded by Jim Harris ?,SELECT DISTINCT ?uri WHERE {?uri <http://dbpedia.org/ontology/subsidiary> #ent . ?uri <http://dbpedia.org/ontology/foundedBy> <http://dbpedia.org/resource/Jim_Harris_(entrepreneur)>  . ?uri <http://www.w3.org/1999/02/22-rdf-syntax-ns#type> <http://dbpedia.org/ontology/Company>}
Count all the books written by an author buried in the Convent of Barefoot Trinitarians?,SELECT COUNT(DISTINCT ?uri) WHERE { ?x <http://dbpedia.org/ontology/restingPlace> <http://dbpedia.org/resource/Convent_of_the_Barefoot_Trinitarians> . ?uri <http://dbpedia.org/ontology/author> ?x  . ?uri <http://www.w3.org/1999/02/22-rdf-syntax-ns#type> <http://dbpedia.org/ontology/Book>}
Name the city with leader as Esther Alder and neighboring municipality as Pregny-Chambsy?,SELECT DISTINCT ?uri WHERE {?uri <http://dbpedia.org/ontology/mayor> #ent . ?uri <http://dbpedia.org/ontology/neighboringMunicipality> #ent  . ?uri <http://www.w3.org/1999/02/22-rdf-syntax-ns#type> <http://dbpedia.org/ontology/Location>}
Was Blade Runner cinematographed by JordanCronenweth?,ASK WHERE { #ent <http://dbpedia.org/ontology/cinematography> #ent }
Panthera leo fossils and Liger belong to which species?,SELECT DISTINCT ?uri WHERE { #ent <http://dbpedia.org/ontology/species> ?uri. #ent <http://dbpedia.org/ontology/species> ?uri . }
Name the street address of Rhodes-Haverty Building ?,SELECT DISTINCT ?uri WHERE { #ent <http://dbpedia.org/property/address> ?uri }
"Who were the commanders during the events which took place in Sandusky County, Ohio?",SELECT DISTINCT ?uri WHERE { ?x <http://dbpedia.org/ontology/place> #ent . ?x <http://dbpedia.org/ontology/commander> ?uri  . ?x <http://www.w3.org/1999/02/22-rdf-syntax-ns#type> <http://dbpedia.org/ontology/Event>}
Who founded the city where Pat Vincent die?,SELECT DISTINCT ?uri WHERE { #ent <http://dbpedia.org/ontology/deathPlace> ?x . ?x <http://dbpedia.org/ontology/founder> ?uri  . }
Name the kingdom with currency Solidus (coin) and administrative headquarters in Nicomedia?,SELECT DISTINCT ?uri WHERE {?uri <http://dbpedia.org/ontology/currency> #ent . ?uri <http://dbpedia.org/ontology/capital> #ent  . }
Which company has a product named Visual Studio and One Drive as service ?,SELECT DISTINCT ?uri WHERE {?uri <http://dbpedia.org/property/services> #ent . ?uri <http://dbpedia.org/property/products> <http://dbpedia.org/resource/Microsoft_Visual_Studio>  . ?uri <http://www.w3.org/1999/02/22-rdf-syntax-ns#type> <http://dbpedia.org/ontology/Company>}
"Name the river whose mouth place is Old Lyme, Connecticut?",SELECT DISTINCT ?uri WHERE {?uri <http://dbpedia.org/ontology/mouthPlace> #ent  . ?uri <http://www.w3.org/1999/02/22-rdf-syntax-ns#type> <http://dbpedia.org/ontology/River>}
Which division of the Runewaker Entertainment is also the  destinations of the Airtours International Airways?,SELECT DISTINCT ?uri WHERE { #ent <http://dbpedia.org/ontology/division> ?uri. #ent <http://dbpedia.org/property/destinations> ?uri}
Which show's network is Prime time Entertainment and has Douglas Netter as executive producer ?,SELECT DISTINCT ?uri WHERE {?uri <http://dbpedia.org/property/network> <http://dbpedia.org/resource/Prime_Time_Entertainment_Network> . ?uri <http://dbpedia.org/ontology/executiveProducer> #ent  . ?uri <http://www.w3.org/1999/02/22-rdf-syntax-ns#type> <http://dbpedia.org/ontology/TelevisionShow>}
